{
  "$schema": "./skills-catalog.schema.json",
  "catalog_version": 1,
  "domains": [
    "commercialization",
    "documents",
    "research",
    "writing"
  ],
  "generated_by": "scripts/generate_skill_catalog.py",
  "notes": [
    "This catalog is generated from all SKILL.md files under the repository.",
    "Add new skills by adding a skill folder with SKILL.md; no central list edit is required.",
    "Optional per-skill catalog.json sidecars may add or override structured metadata; an explicit capabilities, inputs, or outputs list replaces the inferred one."
  ],
  "open_catalog": true,
  "skill_count": 21,
  "skills": [
    {
      "agent_metadata": {
        "interface": {
          "default_prompt": "Use $commercialize-academic-research to evaluate this research asset, separate evidence from assumptions, compare commercialization paths, and define the next validation tests.",
          "display_name": "Research Commercialization",
          "short_description": "Evidence-gated research commercialization"
        }
      },
      "capabilities": [
        "commercialization",
        "stage-routing"
      ],
      "description": "Run evidence-gated commercialization analysis for academic research by translating a bounded research asset into workflow pain, current workarounds, buyer and budget logic, commercialization paths, risk-retirement tests, and kill/pivot/continue decisions. Use when Codex needs to evaluate market pull for a paper, prototype, dataset, device, algorithm, lab result, or platform technology; distinguish user, buyer, operator, procurement, and budget roles; compare startup, licensing, partnership, service, or component routes; identify beachhead wedges; build validation sprints; or red-team unsupported commercialization claims.",
      "domain": "commercialization",
      "frontmatter": {
        "description": "Run evidence-gated commercialization analysis for academic research by translating a bounded research asset into workflow pain, current workarounds, buyer and budget logic, commercialization paths, risk-retirement tests, and kill/pivot/continue decisions. Use when Codex needs to evaluate market pull for a paper, prototype, dataset, device, algorithm, lab result, or platform technology; distinguish user, buyer, operator, procurement, and budget roles; compare startup, licensing, partnership, service, or component routes; identify beachhead wedges; build validation sprints; or red-team unsupported commercialization claims.",
        "name": "commercialize-academic-research"
      },
      "inputs": [],
      "name": "commercialize-academic-research",
      "outputs": [
        ".context.md",
        ".decision-log.md",
        ".evidence-ledger.md",
        ".options.md",
        ".pain-points.md",
        ".source-log.md",
        ".validation-plan.md"
      ],
      "path": "commercialization/commercialize-academic-research",
      "primary_intent": "analysis",
      "related_skills": [
        "research-experiment-plan",
        "research-novelty-review",
        "research-pipeline-planner",
        "research-results-auditor",
        "research-systematic-literature-review",
        "research-zotero"
      ],
      "resources": {
        "agents": [
          "agents/openai.yaml"
        ],
        "assets": [],
        "prompts": [],
        "references": [
          "references/commercialization-patterns.md",
          "references/diligence-checklists.md",
          "references/discovery-question-bank.md",
          "references/domain-adapters.md",
          "references/evaluation-rubric.md"
        ],
        "scripts": [
          "scripts/add_source_log.py",
          "scripts/init_case_pack.py",
          "scripts/validate_case_pack.py"
        ]
      },
      "skill_file": "commercialization/commercialize-academic-research/SKILL.md"
    },
    {
      "agent_metadata": {
        "interface": {
          "default_prompt": "Use $market-patent-diligence to search market, competitor, procurement, funding, regulatory, and patent evidence for this research asset; log sources, separate facts from inferences, and prepare a handoff to commercialization analysis.",
          "display_name": "Market Patent Diligence",
          "short_description": "Source-grounded market and patent diligence"
        }
      },
      "capabilities": [
        "commercialization"
      ],
      "description": "source-grounded market, competitor, procurement, funding, regulatory, and patent-landscape diligence for academic research commercialization. use when codex needs to search public market or patent information for a research asset, technology, prototype, dataset, method, device, or commercialization thesis; map incumbents, substitutes, buyers, assignees, patent families, citations, ownership signals, public funding, procurement demand, regulatory/reimbursement constraints, and evidence gaps; prepare diligence artifacts for commercialize-academic-research or related research skills.",
      "domain": "commercialization",
      "frontmatter": {
        "description": "source-grounded market, competitor, procurement, funding, regulatory, and patent-landscape diligence for academic research commercialization. use when codex needs to search public market or patent information for a research asset, technology, prototype, dataset, method, device, or commercialization thesis; map incumbents, substitutes, buyers, assignees, patent families, citations, ownership signals, public funding, procurement demand, regulatory/reimbursement constraints, and evidence gaps; prepare diligence artifacts for commercialize-academic-research or related research skills.",
        "name": "market-patent-diligence"
      },
      "inputs": [],
      "name": "market-patent-diligence",
      "outputs": [
        ".competitor-substitute-map.md",
        ".evidence-ledger.md",
        ".handoff-to-commercialization.json",
        ".market-map.md",
        ".patent-landscape.md",
        ".regulatory-procurement-funding.md",
        ".scope.md",
        ".source-log.md",
        "handoff-to-commercialization.json"
      ],
      "path": "commercialization/market-patent-diligence",
      "primary_intent": "review",
      "related_skills": [
        "commercialize-academic-research",
        "research-experiment-plan",
        "research-novelty-review",
        "research-paper-review",
        "research-pipeline-planner",
        "research-results-auditor",
        "research-review-loop",
        "research-systematic-literature-review",
        "research-zotero"
      ],
      "resources": {
        "agents": [
          "agents/openai.yaml"
        ],
        "assets": [],
        "prompts": [],
        "references": [
          "references/market-diligence-guide.md",
          "references/output-templates.md",
          "references/patent-search-guide.md",
          "references/source-taxonomy.md"
        ],
        "scripts": [
          "scripts/init_diligence_pack.py",
          "scripts/validate_diligence_pack.py"
        ]
      },
      "skill_file": "commercialization/market-patent-diligence/SKILL.md"
    },
    {
      "agent_metadata": {
        "interface": {
          "default_prompt": "Use $adversarial-doc-review to adversarially review this document (often a `.md` file path), verify time-sensitive claims with up-to-date sources, and return a structured report in chat by default. For Markdown inputs, cite findings as `path:line` plus the nearest heading. If a file report is requested, write `<docname>.review.md` next to the input document.",
          "display_name": "Adversarial Doc Review",
          "short_description": "Pedantic review + current fact-checking"
        },
        "policy": {
          "allow_implicit_invocation": true
        }
      },
      "capabilities": [
        "literature-review",
        "paper-review",
        "stage-routing"
      ],
      "description": "Pedantic, adversarial stress-testing of documents with claim-by-claim scrutiny, internal consistency checks, citation auditing, and up-to-date fact-checking. Use when asked to critique, peer-review, red-team, verify references, pressure-test time-sensitive statements, or assess whether validation, verification, independence, immutability, isolation, replay, auditability, or route-readiness claims are actually supported; default deliverable is a structured report in chat.",
      "domain": "documents",
      "frontmatter": {
        "description": "Pedantic, adversarial stress-testing of documents with claim-by-claim scrutiny, internal consistency checks, citation auditing, and up-to-date fact-checking. Use when asked to critique, peer-review, red-team, verify references, pressure-test time-sensitive statements, or assess whether validation, verification, independence, immutability, isolation, replay, auditability, or route-readiness claims are actually supported; default deliverable is a structured report in chat.",
        "name": "adversarial-doc-review"
      },
      "inputs": [],
      "name": "adversarial-doc-review",
      "outputs": [
        ".review.md"
      ],
      "path": "documents/adversarial-doc-review",
      "primary_intent": "review",
      "related_skills": [],
      "resources": {
        "agents": [
          "agents/openai.yaml"
        ],
        "assets": [],
        "prompts": [],
        "references": [
          "references/epistemic-assurance-contract.md",
          "references/report-template.md",
          "references/review-checklist.md"
        ],
        "scripts": []
      },
      "skill_file": "documents/adversarial-doc-review/SKILL.md"
    },
    {
      "agent_metadata": {
        "interface": {
          "default_prompt": "Use $document-memory-builder to read the provided documents and create a source-grounded memory pack, using section-aware chunking for long or chaptered material when needed.",
          "display_name": "Document Memory",